#CODE;ENGLISH;FRENCH;GERMAN;;SPANISH;;;;;;;;;x
drunken_tournament;Drunken Fool;Imbécile ivre;Drunken Fool;;Drunken Fool;;;;;;;;;x
drunken_tournament_desc;You once showed up drunk to a tournament and made such a shameful spectacle of yourself that you had to be thrown out.;Vous vous êtes une fois montré ivre à un tournoi, ce fut un spectacle si honteux que vous en avez été mis à la porte. ;You once showed up drunk to a tournament and made such a shameful spectacle of yourself that you had to be thrown out.;;You once showed up drunk to a tournament and made such a shameful spectacle of yourself that you had to be thrown out.;;;;;;;;;x
EVTDESC70000;[Root.GetTitledFirstName] [Root.GetOnlyDynastyName], I hereby invite you to participate in the tourney of [From.Capital.GetName], where Knights and Lords shall test their mettle.\n\n Regards,\n[From.GetFirstName] [From.GetOnlyDynastyName], [From.GetTitle] of [From.PrimaryTitle.GetName];[Root.GetFirstName] [Root.GetOnlyDynastyName], par la présente je vous invite à participer au tournoi de [From.Capital.GetName], où chevaliers et seigneurs prouveront leur valeur.\n\n Cordialement,\n[From.GetFirstName] [From.GetOnlyDynastyName], [From.GetTitle] de [From.PrimaryTitle.GetName];[Root.GetTitledFirstName] [Root.GetOnlyDynastyName], I hereby invite you to participate in the tourney of [From.Capital.GetName], where Knights and Lords shall test their mettle.\n\n Regards,\n[From.GetFirstName] [From.GetOnlyDynastyName], [From.GetTitle] of [From.PrimaryTitle.GetName];;[Root.GetTitledFirstName] [Root.GetOnlyDynastyName], I hereby invite you to participate in the tourney of [From.Capital.GetName], where Knights and Lords shall test their mettle.\n\n Regards,\n[From.GetFirstName] [From.GetOnlyDynastyName], [From.GetTitle] of [From.PrimaryTitle.GetName];;;;;;;;;x
EVTDESC70001;It is time to let the tournament begin and for the next months let all show their martial brilliance.;C'est l'heure de commencer le tournoi, chacun pourra montrer son aptitude au combat lors des prochains mois.;Die Zeit für das Turnier ist gekommen. Für die nächsten Monate kann jeder seine Talente in der Kampfkunst zur Schau stellen.;;Es hora que empiece el torneo. Durante los próximos meses, todos podrán demostrar su habilidad marcial.;;;;;;;;;x
EVTDESC70003;The Tourney ends and although I may not have won any of the melee events my prowess in the lists did not go unnoticed.;Le tournoi s'achève et même si je n'ai remporté aucune des mélées, mes prouesses dans les lices ne sont pas passées inaperçues. ;The Tourney ends and although I may not have won any of the melee events my prowess in the lists did not go unnoticed.;;The Tourney ends and although I may not have won any of the melee events my prowess in the lists did not go unnoticed.;;;;;;;;;x
EVTDESC70004;The Tourney ends and I have shown time and time again my skill at arms. Despite not winning, I prevailed against many knights in the lists, covering myself in glory.;Le Tournoi s'achève et j'ai montré à plusieurs reprises mes talents dans la maîtrise des armes. Bien que je n'ai pas gagné, j'ai prévalu contre de nombreux chevaliers dans les lices, me couvrant de gloire. ;The Tourney ends and I have shown time and time again my skill at arms. Despite not winning, I prevailed against many knights in the lists, covering myself in glory.;;The Tourney ends and I have shown time and time again my skill at arms. Despite not winning, I prevailed against many knights in the lists, covering myself in glory.;;;;;;;;;x
EVTDESC70005;The Tourney ends and I failed to display my full prowess. I won a handful of tilts against lesser men, but was soundly beaten in the later lists.;Le Tournoi s'achève et je ne suis pas parvenu a montré toute ma valeur. J'ai remporté une poignée de combats contre des hommes de moindre valeur, mais j'ai été sévèrement battu dans les dernières lices.  ;The Tourney ends and I failed to display my full prowess. I won a handful of tilts against lesser men, but was soundly beaten in the later lists.;;The Tourney ends and I failed to display my full prowess. I won a handful of tilts against lesser men, but was soundly beaten in the later lists.;;;;;;;;;x
EVTDESC70006;The Tourney ends and I was vanquished in the early rounds. I can still hear the scorn of the crowd, after I was unhorsed time after time.;Le Tournoi s'achève et j'ai été vaincu dans les premiers tours. Je peux encore entendre le mépris et les railleries de la foule à chaque fois qu'on me désarçonnait. ;The Tourney ends and I was vanquished in the early rounds. I can still hear the scorn of the crowd, after I was unhorsed time after time.;;The Tourney ends and I was vanquished in the early rounds. I can still hear the scorn of the crowd, after I was unhorsed time after time.;;;;;;;;;x
EVTDESC70008;I was enjoying the tournament when someone special caught my eye. We attended several events together and I expressed an interest in seeing them more often.;I was enjoying the tournament when someone special caught my eye. We attended several events together and I expressed an interest in seeing them more often.;I was enjoying the tournament when someone special caught my eye. We attended several events together and I expressed an interest in seeing them more often.;;I was enjoying the tournament when someone special caught my eye. We attended several events together and I expressed an interest in seeing them more often.;;;;;;;;;x
EVTDESC70031;I was simply passing time at the tournament when I came across two knights arguing over honor. I knew straight away that the argument was spurious and the result would be unnecessary bloodshed, so I stepped in and prevented it.;Lors du tournoi, j’ai surpris la conversation de deux chevaliers qui débattaient de la question de l’honneur. J’ai très vite compris qu’ils ne parviendraient pas à se mettre d’accord et que le sang allait couler. J’ai réagi pour éviter qu’une telle chose arrive.;I was simply passing time at the tournament when I came across two knights arguing over honor. I knew straight away that the argument was spurious and the result would be unnecessary bloodshed, so I stepped in and prevented it.;;I was simply passing time at the tournament when I came across two knights arguing over honor. I knew straight away that the argument was spurious and the result would be unnecessary bloodshed, so I stepped in and prevented it.;;;;;;;;;x
EVTDESC70034;[From.GetTitledFirstName] [From.GetOnlyDynastyName] has been crowned the winner of my tourney.;[From.GetTitle] [From.GetFirstName] [From.GetOnlyDynastyName] a été couronné vainqueur de mon tournoi.;[From.GetTitledFirstName] [From.GetOnlyDynastyName] has been crowned the winner of my tourney.;;[From.GetTitledFirstName] [From.GetOnlyDynastyName] has been crowned the winner of my tourney.;;;;;;;;;x
EVTDESC70035;[From.GetTitledFirstName] [From.GetOnlyDynastyName]'s bravery won [From.GetHerHim] second place in my tourney.;[From.GetTitle] [From.GetFirstName] [From.GetOnlyDynastyName] a bravement remporté la seconde place de mon tournoi. ;[From.GetTitledFirstName] [From.GetOnlyDynastyName]'s bravery won [From.GetHerHim] second place in my tourney.;;[From.GetTitledFirstName] [From.GetOnlyDynastyName]'s bravery won [From.GetHerHim] second place in my tourney.;;;;;;;;;x
EVTDESC70036;[From.GetTitledFirstName] [From.GetOnlyDynastyName] fought [From.GetHerHis] way to the third place in my tourney.;[From.GetTitle] [From.GetFirstName] [From.GetOnlyDynastyName] s'est taillé un chemin jusqu'à la troisième place de mon tournoi. ;[From.GetTitledFirstName] [From.GetOnlyDynastyName] fought [From.GetHerHis] way to the third place in my tourney.;;[From.GetTitledFirstName] [From.GetOnlyDynastyName] fought [From.GetHerHis] way to the third place in my tourney.;;;;;;;;;x
EVTDESC70038;My liege! Your guest [From.GetTitledFirstName] [From.GetOnlyDynastyName] has tragically been killed during the tournament!;Mon seigneur ! Votre invité [From.GetTitle] [From.GetFirstName] [From.GetOnlyDynastyName] a tragiquement trouvé la mort au cours du tournoi ! ;My liege! Your guest [From.GetTitledFirstName] [From.GetOnlyDynastyName] has tragically been killed during the tournament!;;My liege! Your guest [From.GetTitledFirstName] [From.GetOnlyDynastyName] has tragically been killed during the tournament!;;;;;;;;;x
EVTDESC70039;My liege! Your guest [From.GetTitledFirstName] [From.GetOnlyDynastyName] has tragically been maimed during the tournament!;Mon seigneur ! Votre invité [From.GetTitle] [From.GetFirstName] [From.GetOnlyDynastyName] a été tragiquement mutilé au cours du tournoi !;My liege! Your guest [From.GetTitledFirstName] [From.GetOnlyDynastyName] has tragically been maimed during the tournament!;;My liege! Your guest [From.GetTitledFirstName] [From.GetOnlyDynastyName] has tragically been maimed during the tournament!;;;;;;;;;x
EVTDESC70040;My liege! Your guest [From.GetTitledFirstName] [From.GetOnlyDynastyName] has tragically been wounded during the tournament!;Mon seigneur ! Votre invité [From.GetTitle] [From.GetFirstName] [From.GetOnlyDynastyName]a été tragiquement blessé au cours du tournoi !;My liege! Your guest [From.GetTitledFirstName] [From.GetOnlyDynastyName] has tragically been wounded during the tournament!;;My liege! Your guest [From.GetTitledFirstName] [From.GetOnlyDynastyName] has tragically been wounded during the tournament!;;;;;;;;;x
EVTDESC70050;I have been spending a lot of time with [From.GetFirstName] [From.GetOnlyDynastyName] at the tournament, and [From.GetSheHe] has expressed an interest to spend more time together.;I have been spending a lot of time with [From.GetFirstName] [From.GetOnlyDynastyName] at the tournament, and [From.GetSheHe] has expressed an interest to spend more time together.;I have been spending a lot of time with [From.GetFirstName] [From.GetOnlyDynastyName] at the tournament, and [From.GetSheHe] has expressed an interest to spend more time together.;;I have been spending a lot of time with [From.GetFirstName] [From.GetOnlyDynastyName] at the tournament, and [From.GetSheHe] has expressed an interest to spend more time together.;;;;;;;;;x
EVTDESC70051;[From.GetFirstName] [From.GetOnlyDynastyName] has responded [From.GetSheHe] is also growing fond of me!;[From.GetFirstName] [From.GetOnlyDynastyName] has responded [From.GetSheHe] is also growing fond of me!;[From.GetFirstName] [From.GetOnlyDynastyName] has responded [From.GetSheHe] is also growing fond of me!;;[From.GetFirstName] [From.GetOnlyDynastyName] has responded [From.GetSheHe] is also growing fond of me!;;;;;;;;;x
EVTDESC70052;[FromFrom.GetTitledFirstName] [FromFrom.GetOnlyDynastyName] has been crowned the winner of [From.GetTitle] [From.GetFirstName] [From.GetOnlyDynastyName]'s tournament.;[FromFrom.GetTitle] [FromFrom.GetFirstName] [FromFrom.GetOnlyDynastyName] a été couronné vainqueur du tournoi de [From.GetTitle] [From.GetFirstName] [From.GetOnlyDynastyName].;[FromFrom.GetTitledFirstName] [FromFrom.GetOnlyDynastyName] has been crowned the winner of [From.GetTitle] [From.GetFirstName] [From.GetOnlyDynastyName]'s tournament.;;[FromFrom.GetTitledFirstName] [FromFrom.GetOnlyDynastyName] has been crowned the winner of [From.GetTitle] [From.GetFirstName] [From.GetOnlyDynastyName]'s tournament.;;;;;;;;;x
EVTDESC70053;As winner of the Tourney of [From.Capital.GetName] I have the honour of selecting the Queen of Love and Beauty for the tournament.;En tant que vainqueur du Tournoi de [From.Capital.GetName] j'ai l'honneur de choisir la reine d'amour et de beauté du tournoi.;As winner of the Tourney of [From.Capital.GetName] I have the honour of selecting the Queen of Love and Beauty for the tournament.;;As winner of the Tourney of [From.Capital.GetName] I have the honour of selecting the Queen of Love and Beauty for the tournament.;;;;;;;;;x
EVTDESC70054;A previously unknown hedge knight has been crowned the winner of my tourney, perhaps I should take him into my service?;Un chevalier errant auparavant inconnu a été couronné vainqueur de mon tournoi. Peut-être devrais-je le prendre à mon service ?;A previously unknown hedge knight has been crowned the winner of my tourney, perhaps I should take him into my service?;;A previously unknown hedge knight has been crowned the winner of my tourney, perhaps I should take him into my service?;;;;;;;;;x
EVTDESC70055;A previously unknown hedge knight has won second place at my tourney, perhaps I should take him into my service?;Un chevalier errant auparavant inconnu a remporté la seconde place de mon tournoi. Peut-être devrais-je le prendre à mon service ?;A previously unknown hedge knight has won second place at my tourney, perhaps I should take him into my service?;;A previously unknown hedge knight has won second place at my tourney, perhaps I should take him into my service?;;;;;;;;;x
EVTDESC70056;A previously unknown hedge knight has won third place at my tourney, perhaps I should take him into my service?;Un chevalier errant auparavant inconnu a remporté la troisième place de mon tournoi. Peut-être devrais-je le prendre à mon service ?;A previously unknown hedge knight has won third place at my tourney, perhaps I should take him into my service?;;A previously unknown hedge knight has won third place at my tourney, perhaps I should take him into my service?;;;;;;;;;x
EVTDESC70057;A great honour has been bestowed upon me, [From.GetTitledFirstName] [From.GetOnlyDynastyName] has chosen me as Queen of Love and Beauty for the Tourney of [FromFrom.Capital.GetName]!;Un grand honneur m'a été accordé, [From.GetTitle] [From.GetFirstName] [From.GetOnlyDynastyName] m'a choisie comme Reine d'Amour et de Beauté du Tournoi de [FromFrom.Capital.GetName] !;A great honour has been bestowed upon me, [From.GetTitledFirstName] [From.GetOnlyDynastyName] has chosen me as Queen of Love and Beauty for the Tourney of [FromFrom.Capital.GetName]!;;A great honour has been bestowed upon me, [From.GetTitledFirstName] [From.GetOnlyDynastyName] has chosen me as Queen of Love and Beauty for the Tourney of [FromFrom.Capital.GetName]!;;;;;;;;;x
EVTDESC70058;[From.GetBestName] has been crowned Queen of love and Beauty by the winner of my Tourney;[From.GetFirstName] [From.GetOnlyDynastyName] a été couronné Reine d'Amour et de Beauté par le vainqueur de mon Tournoi.;[From.GetFirstName] [From.GetOnlyDynastyName] has been crowned Queen of love and Beauty by the winner of my Tourney;;[From.GetFirstName] [From.GetOnlyDynastyName] has been crowned Queen of love and Beauty by the winner of my Tourney;;;;;;;;;x
EVTDESC70059;[FromFrom.GetBestName] has been crowned Queen of love and Beauty by the winner of the Tourney of [From.Capital.GetName];[FromFrom.GetFirstName] [FromFrom.GetOnlyDynastyName] a été couronnée Reine d'Amour et de Beauté par le vainqueur du Tournoi de [From.Capital.GetName].;[FromFrom.GetFirstName] [FromFrom.GetOnlyDynastyName] has been crowned Queen of love and Beauty by the winner of the Tourney of [From.Capital.GetName];;[FromFrom.GetFirstName] [FromFrom.GetOnlyDynastyName] has been crowned Queen of love and Beauty by the winner of the Tourney of [From.Capital.GetName];;;;;;;;;x
EVTDESC70060;My death sadly means the tourney has to be cancelled;Ma mort signifie malheusement que le tournoi doit être annulé.;My death sadly means the tourney has to be cancelled;;My death sadly means the tourney has to be cancelled;;;;;;;;;x
EVTDESC70061;During the tourney feasts a fellow competitor was heard to boast how many more titles he has won than you, and then went on to describe how he would vanquish you in the lists. Shall I let this stand?;Durant le festin organisé pour le tournoi, l'un des compétiteurs s'est vanté d'avoir remporté bien plus de titres que vous, puis il a décrit comment il vous vaincrait dans les lices lors de ce tournoi. Le laisserai-je faire?;During the tourney feasts a fellow competitor was heard to boast how many more titles he has won than you, and then went on to describe how he would vanquish you in the lists. Shall I let this stand?;;During the tourney feasts a fellow competitor was heard to boast how many more titles he has won than you, and then went on to describe how he would vanquish you in the lists. Shall I let this stand?;;;;;;;;;x
EVTDESC70062;During the tourney feasts I was jesting with some companions about how I'd vanquish my opponents in the lists, particularly one knight who has less titles than me. He appears to bear a grudge now...;Durant le festin organisé pour le tournoi, j'ai plaisanté avec quelques compagnons sur la façon dont j'ai terrassé mes adversaires dans les lices, et particulièrement un chevalier qui a moins de titres que moi. Il semble avoir une dent contre moi maintenant...;During the tourney feasts I was jesting with some companions about how I'd vanquish my opponents in the lists, particularly one knight who has less titles than me. He appears to bear a grudge now...;;During the tourney feasts I was jesting with some companions about how I'd vanquish my opponents in the lists, particularly one knight who has less titles than me. He appears to bear a grudge now...;;;;;;;;;x
EVTDESC70063;During the tourney feasts I was jesting with some companions about how I'd vanquish my opponents in the lists, particularly [From.GetFirstName] [From.GetOnlyDynastyName] who has less titles than me.  He then proceeded to walk calmly across the hall and threw his glove full in my face, challenging me to single combat!;Durant le festin organisé pour le tournoi, j'ai plaisanté avec quelques compagnons sur la façon dont j'ai terrassé mes adversaires dans les lices, et particulièrement [From.GetFirstName] [From.GetOnlyDynastyName] qui a moins de titres que moi. Il s'est levé et a traversé la grande salle avant de me jeter son gant au visage, me défiant en combat singulier !;During the tourney feasts I was jesting with some companions about how I'd vanquish my opponents in the lists, particularly [From.GetFirstName] [From.GetOnlyDynastyName] who has less titles than me.  He then proceeded to walk calmly across the hall and threw his glove full in my face, challenging me to single combat!;;During the tourney feasts I was jesting with some companions about how I'd vanquish my opponents in the lists, particularly [From.GetFirstName] [From.GetOnlyDynastyName] who has less titles than me.  He then proceeded to walk calmly across the hall and threw his glove full in my face, challenging me to single combat!;;;;;;;;;x
EVTDESC70064;The hall fell silent as your glove fell to the floor after you threw it square in [From.GetTitledFirstName] [From.GetOnlyDynastyName]'s face. His eyes looked panicked before he backed down and apologised profusely for his dishonourable words.;Un silence de mort s'est abattu sur la grande salle au moment où votre gant a atteint avec force le visage de [From.GetFirstName] [From.GetOnlyDynastyName]. Vous pouviez lire l'affolement dans son regard avant qu'il ne cède et vous fasse ses plus plates excuses pour ses calomnies.;The hall fell silent as your glove fell to the floor after you threw it square in [From.GetTitledFirstName] [From.GetOnlyDynastyName]'s face. His eyes looked panicked before he backed down and apologised profusely for his dishonourable words.;;The hall fell silent as your glove fell to the floor after you threw it square in [From.GetTitledFirstName] [From.GetOnlyDynastyName]'s face. His eyes looked panicked before he backed down and apologised profusely for his dishonourable words.;;;;;;;;;x
EVTDESC70065;[From.GetTitledFirstName] [From.GetOnlyDynastyName] accepted my challenge to single combat, and I proceeded to vanquish him comfortably, no one will mock me now.;[From.GetFirstName] [From.GetOnlyDynastyName] a accepté mon défi et m'a affronté en combat singulier. Je l'ai vaincu promptement, personne n'osera plus me railler désormais.;[From.GetTitledFirstName] [From.GetOnlyDynastyName] accepted my challenge to single combat, and I proceeded to vanquish him comfortably, no one will mock me now.;;[From.GetTitledFirstName] [From.GetOnlyDynastyName] accepted my challenge to single combat, and I proceeded to vanquish him comfortably, no one will mock me now.;;;;;;;;;x
EVTDESC70066;[From.GetTitledFirstName] [From.GetOnlyDynastyName] accepted my challenge to single combat, and our duel ended without a clear victor before we were seperated. This will not be forgotten.;[From.GetFirstName] [From.GetOnlyDynastyName] a accepté mon défi et m'a affronté en combat singulier. Notre duel s'est achevé sans qu'on puisse désigner clairement un vainqueur. Cela ne sera pas oublié.;[From.GetTitledFirstName] [From.GetOnlyDynastyName] accepted my challenge to single combat, and our duel ended without a clear victor before we were seperated. This will not be forgotten.;;[From.GetTitledFirstName] [From.GetOnlyDynastyName] accepted my challenge to single combat, and our duel ended without a clear victor before we were seperated. This will not be forgotten.;;;;;;;;;x
EVTDESC70067;[From.GetTitledFirstName] [From.GetOnlyDynastyName] accepted my challenge to single combat, and proceeded to defeat me after a fierce clash. Perhaps I should of stayed silent...;[From.GetFirstName] [From.GetOnlyDynastyName] a accepté mon défi et m'a affronté en combat singulier. Il m'a terrassé. Peut-être devrais-je désormais garder le silence…;[From.GetTitledFirstName] [From.GetOnlyDynastyName] accepted my challenge to single combat, and proceeded to defeat me after a fierce clash. Perhaps I should of stayed silent...;;[From.GetTitledFirstName] [From.GetOnlyDynastyName] accepted my challenge to single combat, and proceeded to defeat me after a fierce clash. Perhaps I should of stayed silent...;;;;;;;;;x
EVTDESC70068;[FromFrom.GetTitledFirstName] [FromFrom.GetOnlyDynastyName] defeated me in the duel, he claims his honour is restored, what of mine?;[FromFrom.GetFirstName] [FromFrom.GetOnlyDynastyName] m'a défait en duel, il a proclamé que son honneur était lavé, mais le mien?;[FromFrom.GetTitledFirstName] [FromFrom.GetOnlyDynastyName] defeated me in the duel, he claims his honour is restored, what of mine?;;[FromFrom.GetTitledFirstName] [FromFrom.GetOnlyDynastyName] defeated me in the duel, he claims his honour is restored, what of mine?;;;;;;;;;x
EVTDESC70069;The duel with [FromFrom.GetTitledFirstName] [FromFrom.GetOnlyDynastyName] ended without a clear victor before we were seperated, this will not be forgotten.;Le duel avec [FromFrom.GetFirstName] [FromFrom.GetOnlyDynastyName] s'est achevé sans que l'on puisse désigner clairement un vainqueur. Ce ne sera pas oublié.;The duel with [FromFrom.GetTitledFirstName] [FromFrom.GetOnlyDynastyName] ended without a clear victor before we were seperated, this will not be forgotten.;;The duel with [FromFrom.GetTitledFirstName] [FromFrom.GetOnlyDynastyName] ended without a clear victor before we were seperated, this will not be forgotten.;;;;;;;;;x
EVTDESC70070;The duel with [FromFrom.GetTitledFirstName] [FromFrom.GetOnlyDynastyName] ended with me the clear victor, and my assertion of superior prowess vindicated. This bodes well for the tourney!;Le duel avec [FromFrom.GetFirstName] [FromFrom.GetOnlyDynastyName] s'est achevé sur ma nette victoire et mes affirmations quant à ma supériorité confirmées. Ceci est de bon augure pour le tournoi ! ;The duel with [FromFrom.GetTitledFirstName] [FromFrom.GetOnlyDynastyName] ended with me the clear victor, and my assertion of superior prowess vindicated. This bodes well for the tourney!;;The duel with [FromFrom.GetTitledFirstName] [FromFrom.GetOnlyDynastyName] ended with me the clear victor, and my assertion of superior prowess vindicated. This bodes well for the tourney!;;;;;;;;;x
EVTDESC70071;The hall fell silent as [From.GetFirstName] [From.GetOnlyDynastyName]'s  glove fell to the floor after he threw it square in [FromFrom.GetFirstName] [FromFrom.GetOnlyDynastyName]'s face. The men say this was because of [FromFrom.GetFirstName]'s jests, the result is [From.GetFirstName] [From.GetOnlyDynastyName]'s victory in the ensuing duel.;Un silence de mort s'est abattu sur la grande salle alors que le gant de [From.GetFirstName] [From.GetOnlyDynastyName] retombait à terre après avoir gifflé le visage de [FromFrom.GetFirstName] [FromFrom.GetOnlyDynastyName]. On dit que c'est à cause des plaisanteries de [FromFrom.GetFirstName]. Le duel qui s'ensuivit a vu la victoire de [From.GetFirstName] [From.GetOnlyDynastyName].;The hall fell silent as [From.GetFirstName] [From.GetOnlyDynastyName]'s  glove fell to the floor after he threw it square in [FromFrom.GetFirstName] [FromFrom.GetOnlyDynastyName]'s face. The men say this was because of [FromFrom.GetFirstName]'s jests, the result is [From.GetFirstName] [From.GetOnlyDynastyName]'s victory in the ensuing duel.;;The hall fell silent as [From.GetFirstName] [From.GetOnlyDynastyName]'s  glove fell to the floor after he threw it square in [FromFrom.GetFirstName] [FromFrom.GetOnlyDynastyName]'s face. The men say this was because of [FromFrom.GetFirstName]'s jests, the result is [From.GetFirstName] [From.GetOnlyDynastyName]'s victory in the ensuing duel.;;;;;;;;;x
