#CODE;ENGLISH;FRENCH;GERMAN;;SPANISH;;;;;;;;;x
EVTDESC70072;The hall fell silent as [From.GetFirstName] [From.GetOnlyDynastyName]'s  glove fell to the floor after he threw it square in [FromFrom.GetFirstName] [FromFrom.GetOnlyDynastyName]'s face. The men say this was because of [FromFrom.GetFirstName]'s jests, the victor was unclear before the combatants were seperated.;Un silence de mort s'est abattu sur la grande salle alors que le gant de [From.GetFirstName] [From.GetOnlyDynastyName] retombait à terre après avoir gifflé le visage de [FromFrom.GetFirstName] [FromFrom.GetOnlyDynastyName]. On dit que c'est à cause des plaisanteries de [FromFrom.GetFirstName]. Le duel qui s'ensuivit n'a pas réussi à départager les deux combattants.;The hall fell silent as [From.GetFirstName] [From.GetOnlyDynastyName]'s  glove fell to the floor after he threw it square in [FromFrom.GetFirstName] [FromFrom.GetOnlyDynastyName]'s face. The men say this was because of [FromFrom.GetFirstName]'s jests, the victor was unclear before the combatants were seperated.;;The hall fell silent as [From.GetFirstName] [From.GetOnlyDynastyName]'s  glove fell to the floor after he threw it square in [FromFrom.GetFirstName] [FromFrom.GetOnlyDynastyName]'s face. The men say this was because of [FromFrom.GetFirstName]'s jests, the victor was unclear before the combatants were seperated.;;;;;;;;;x
EVTDESC70073;The hall fell silent as [From.GetFirstName] [From.GetOnlyDynastyName]'s  glove fell to the floor after he threw it square in [FromFrom.GetFirstName] [FromFrom.GetOnlyDynastyName]'s face. The men say this was because of [FromFrom.GetFirstName]'s jests, the result is [FromFrom.GetFirstName] [FromFrom.GetOnlyDynastyName]'s victory in the ensuing duel.;Un silence de mort s'est abattu sur la grande salle alors que le gant de [From.GetFirstName] [From.GetOnlyDynastyName] retombait à terre après avoir gifflé le visage de [FromFrom.GetFirstName] [FromFrom.GetOnlyDynastyName]. On dit que c'est à cause des plaisanteries de [FromFrom.GetFirstName]. Le duel qui s'ensuivit a vu la victoire de [FromFrom.GetFirstName] [FromFrom.GetOnlyDynastyName].;The hall fell silent as [From.GetFirstName] [From.GetOnlyDynastyName]'s  glove fell to the floor after he threw it square in [FromFrom.GetFirstName] [FromFrom.GetOnlyDynastyName]'s face. The men say this was because of [FromFrom.GetFirstName]'s jests, the result is [FromFrom.GetFirstName] [FromFrom.GetOnlyDynastyName]'s victory in the ensuing duel.;;The hall fell silent as [From.GetFirstName] [From.GetOnlyDynastyName]'s  glove fell to the floor after he threw it square in [FromFrom.GetFirstName] [FromFrom.GetOnlyDynastyName]'s face. The men say this was because of [FromFrom.GetFirstName]'s jests, the result is [FromFrom.GetFirstName] [FromFrom.GetOnlyDynastyName]'s victory in the ensuing duel.;;;;;;;;;x
EVTDESC70074;During the post tourney celebrations I caught the gaze of my Queen of Love and Beauty, could it be that she desires me?;Durant les célébrations qui ont suivi le tournoi, j'ai remarqué les regards que m'a lancé ma Reine d'Amour et de Beauté. Se pourrait-il qu'elle me désire ?;During the post tourney celebrations I caught the gaze of my Queen of Love and Beauty, could it be that she desires me?;;During the post tourney celebrations I caught the gaze of my Queen of Love and Beauty, could it be that she desires me?;;;;;;;;;x
EVTDESC70075;[From.GetTitledFirstName] [From.GetOnlyDynastyName], the winner of the tourney and my champion, has been trying to seduce me all night. He did name me Queen of love and Beauty, perhaps we are meant for eachother?;[From.GetTitle] [From.GetFirstName] [From.GetOnlyDynastyName], le vainqueur du tournoi et mon champion, a tenté de me séduire durant une bonne partie de la nuit. Il m'a nommée Reine d'Amour et de Beauté, peut-être sommes nous faits l'un pour l'autre ?;[From.GetTitledFirstName] [From.GetOnlyDynastyName], the winner of the tourney and my champion, has been trying to seduce me all night. He did name me Queen of love and Beauty, perhaps we are meant for eachother?;;[From.GetTitledFirstName] [From.GetOnlyDynastyName], the winner of the tourney and my champion, has been trying to seduce me all night. He did name me Queen of love and Beauty, perhaps we are meant for eachother?;;;;;;;;;x
EVTDESC70076;After much flirting and merriment I have managed to seduce [From.GetFirstName] [From.GetOnlyDynastyName], my Queen of Love and Beauty. My tourney is complete!;Après l'avoir courtisé et égayé pendant des heures je suis parvenu à séduire [From.GetFirstName] [From.GetOnlyDynastyName], ma Reine d'Amour et de Beauté. Mon tournoi est une totale réussite!;After much flirting and merriment I have managed to seduce [From.GetFirstName] [From.GetOnlyDynastyName], my Queen of Love and Beauty. My tourney is complete!;;After much flirting and merriment I have managed to seduce [From.GetFirstName] [From.GetOnlyDynastyName], my Queen of Love and Beauty. My tourney is complete!;;;;;;;;;x
EVTDESC70077;Despite my best efforts at flirtation and seduction, [From.GetFirstName] [From.GetOnlyDynastyName], my Queen of Love and Beauty, has rejected my advancements.;Malgré tous mes efforts pour la courtiser et la séduire, [From.GetFirstName] [From.GetOnlyDynastyName], ma Reine d'Amour et de Beauté, a repoussé mes avances.;Despite my best efforts at flirtation and seduction, [From.GetFirstName] [From.GetOnlyDynastyName], my Queen of Love and Beauty, has rejected my advancements.;;Despite my best efforts at flirtation and seduction, [From.GetFirstName] [From.GetOnlyDynastyName], my Queen of Love and Beauty, has rejected my advancements.;;;;;;;;;x
EVTDESC70078;My liege, please choose a tier of tourney for which you would like to know of the medal winners;Messire, choisissez s'il vous plaît une taille de tournoi pour lequel vous voudriez connaître les médailles des vainqueurs;My liege, please choose a tier of tourney for which you would like to know of the medal winners;;My liege, please choose a tier of tourney for which you would like to know of the medal winners;;;;;;;;;x
EVTDESC70079;Here lists all living medal winners of the Grand Tourneys of Europe, where all Knights and Lords of the realm are invited.;Ici sont inscrites toutes les personnes vivantes ayant remporté une médaille les Grands Tournois de Europa, où tous les chevaliers et les seigneurs sont invités.;Here lists all living medal winners of the Grand Tourneys of Europe, where all Knights and Lords of the realm are invited.;;Here lists all living medal winners of the Grand Tourneys of Europe, where all Knights and Lords of the realm are invited.;;;;;;;;;x
EVTDESC70080;Here lists all living medal winners of the Tourneys in your region.;Ici sont inscrites toutes les personnes vivantes ayant remporté une médialle dans les Grands Tournois de votre région.;Here lists all living medal winners of the Tourneys in your region.;;Here lists all living medal winners of the Tourneys in your region.;;;;;;;;;x
EVTDESC70081;Here lists all living medal winners of the local Tourneys;Ici sont inscrites toutes les personnes ayant remporté une médaille dans les Tournois locaux.;Here lists all living medal winners of the local Tourneys;;Here lists all living medal winners of the local Tourneys;;;;;;;;;x
EVTDESC70082;You stumble out to the tourney grounds in a haze of ale, ready to face your next joust. You try to mount your horse, but trip and fall from the saddle. You begin to notice the eyes of the tourney-goers on you, and realize to your horror that you've forgotten to don your armor and most of your clothes.;Vous vous sentez prêt à participez à votre prochaine joute. Vous empestez le vin et c'est en titubant que vous entrez sur le terrain. Vous essayez de monter sur votre cheval mais perdez l'équilibre avant de tomber de votre selle. Vous remarquez les regards de la foule et réalisez avec horreur que vous avez oublié de mettre votre armure et la plupart de vos vêtements.;You stumble out to the tourney grounds in a haze of ale, ready to face your next joust. You try to mount your horse, but trip and fall from the saddle. You begin to notice the eyes of the tourney-goers on you, and realize to your horror that you've forgotten to don your armor and most of your clothes.;;You stumble out to the tourney grounds in a haze of ale, ready to face your next joust. You try to mount your horse, but trip and fall from the saddle. You begin to notice the eyes of the tourney-goers on you, and realize to your horror that you've forgotten to don your armor and most of your clothes.;;;;;;;;;x
EVTDESC70083;It is [From.GetBestName]'s turn to joust, but to the crowd's shock, [From.GetSheHe] stumbles out to the tourney field late and clearly drunk, with none of [From.GetHerHis] armor and only slightly more of [From.GetHerHis] clothing. [From.GetSheHeCap] tries to mount [From.GetHerHis] horse, but trips and falls comically to the ground, unable even to ride.;C'est au tour de [From.GetBestName] d'entrer en lice, mais la foule est choquée. [From.GetSheHe] arrive en titubant sur le terrain et est clairement ivre. [From.GetSheHe] ne porte pas d'armure et a oublié de mettre la plupart de ses vêtements. [From.GetSheHeCap] essaye de monter sur son cheval, mais tombe immédiatement de selle.;It is [From.GetBestName]'s turn to joust, but to the crowd's shock, [From.GetSheHe] stumbles out to the tourney field late and clearly drunk, with none of [From.GetHerHis] armor and only slightly more of [From.GetHerHis] clothing. [From.GetSheHeCap] tries to mount [From.GetHerHis] horse, but trips and falls comically to the ground, unable even to ride.;;It is [From.GetBestName]'s turn to joust, but to the crowd's shock, [From.GetSheHe] stumbles out to the tourney field late and clearly drunk, with none of [From.GetHerHis] armor and only slightly more of [From.GetHerHis] clothing. [From.GetSheHeCap] tries to mount [From.GetHerHis] horse, but trips and falls comically to the ground, unable even to ride.;;;;;;;;;x
EVTDESC70084;[From.GetBestName] was furious at your disrespect, and demanded that you be thrown out of the tournament!;[From.GetBestName] était furieux(se) de votre manque de respect et a demandé à ce que vous soyez mis à la porte du tournoi !;[From.GetBestName] was furious at your disrespect, and demanded that you be thrown out of the tournament!;;[From.GetBestName] was furious at your disrespect, and demanded that you be thrown out of the tournament!;;;;;;;;;x
EVTDESC70085;Fortunately, [From.GetBestName] found your drunken antics more amusing than insulting. You still had to drop out of the tournament, but [From.GetHerHis] approval softens the blow to your reputation, somewhat.;Heureusement, [From.GetBestName] a trouvé vos cabrioles d'ivrogne plus amusantes qu'insultantes. Vous avez dû quitter le tournoi, mais son approbation a quelque peu atténué l'impact de cette frasque sur votre réputation.;Fortunately, [From.GetBestName] found your drunken antics more amusing than insulting. You still had to drop out of the tournament, but [From.GetHerHis] approval softens the blow to your reputation, somewhat.;;Fortunately, [From.GetBestName] found your drunken antics more amusing than insulting. You still had to drop out of the tournament, but [From.GetHerHis] approval softens the blow to your reputation, somewhat.;;;;;;;;;x
EVTDESC70086;[Root.GetTitledFirstName] [Root.GetOnlyDynastyName], I hereby invite you to attend the tourney of [From.Capital.GetName], where you shall see Knights and Lords test their mettle.\n\n Regards,\n[From.GetFirstName] [From.GetOnlyDynastyName], [From.GetTitle] of [From.PrimaryTitle.GetName];[Root.GetTitledFirstName] [Root.GetOnlyDynastyName], par la présente je vous invite à assister au tournoi de [From.Capital.GetName], où Chevaliers et Seigneurs mettront à l'épreuve leur courage.\n\n Cordialement,\n[From.GetFirstName] [From.GetOnlyDynastyName], [From.GetTitle] de [From.PrimaryTitle.GetName].;[Root.GetTitledFirstName] [Root.GetOnlyDynastyName], I hereby invite you to attend the tourney of [From.Capital.GetName], where you shall see Knights and Lords test their mettle.\n\n Regards,\n[From.GetFirstName] [From.GetOnlyDynastyName], [From.GetTitle] of [From.PrimaryTitle.GetName];;[Root.GetTitledFirstName] [Root.GetOnlyDynastyName], I hereby invite you to attend the tourney of [From.Capital.GetName], where you shall see Knights and Lords test their mettle.\n\n Regards,\n[From.GetFirstName] [From.GetOnlyDynastyName], [From.GetTitle] of [From.PrimaryTitle.GetName];;;;;;;;;x
EVTDESC70087;[FromFrom.GetTitledFirstName] [FromFrom.GetOnlyDynastyName] placed second in [From.GetTitle] [From.GetFirstName] [From.GetOnlyDynastyName]'s tournament.;[FromFrom.GetTitledFirstName] [FromFrom.GetOnlyDynastyName] a obtenu la seconde place du tournoi de  [From.GetTitle] [From.GetFirstName] [From.GetOnlyDynastyName].;[FromFrom.GetTitledFirstName] [FromFrom.GetOnlyDynastyName] placed second in [From.GetTitle] [From.GetFirstName] [From.GetOnlyDynastyName]'s tournament.;;[FromFrom.GetTitledFirstName] [FromFrom.GetOnlyDynastyName] placed second in [From.GetTitle] [From.GetFirstName] [From.GetOnlyDynastyName]'s tournament.;;;;;;;;;x
EVTDESC70088;[FromFrom.GetTitledFirstName] [FromFrom.GetOnlyDynastyName] placed third in [From.GetTitle] [From.GetFirstName] [From.GetOnlyDynastyName]'s tournament.;[FromFrom.GetTitledFirstName] [FromFrom.GetOnlyDynastyName] a obtenu la troisième place du tournoi de [From.GetTitle] [From.GetFirstName] [From.GetOnlyDynastyName].;[FromFrom.GetTitledFirstName] [FromFrom.GetOnlyDynastyName] placed third in [From.GetTitle] [From.GetFirstName] [From.GetOnlyDynastyName]'s tournament.;;[FromFrom.GetTitledFirstName] [FromFrom.GetOnlyDynastyName] placed third in [From.GetTitle] [From.GetFirstName] [From.GetOnlyDynastyName]'s tournament.;;;;;;;;;x
EVTDESC70089;[FromFrom.GetTitledFirstName] [FromFrom.GetOnlyDynastyName] has been tragically killed during [From.GetTitle] [From.GetFirstName] [From.GetOnlyDynastyName]'s tournament.;[FromFrom.GetTitledFirstName] [FromFrom.GetOnlyDynastyName] a tragiquement trouvé la mort lors du tournoi de [From.GetTitle] [From.GetFirstName] [From.GetOnlyDynastyName].;[FromFrom.GetTitledFirstName] [FromFrom.GetOnlyDynastyName] has been tragically killed during [From.GetTitle] [From.GetFirstName] [From.GetOnlyDynastyName]'s tournament.;;[FromFrom.GetTitledFirstName] [FromFrom.GetOnlyDynastyName] has been tragically killed during [From.GetTitle] [From.GetFirstName] [From.GetOnlyDynastyName]'s tournament.;;;;;;;;;x
EVTDESC70090;[FromFrom.GetTitledFirstName] [FromFrom.GetOnlyDynastyName] has been horrifically maimed jousting in [From.GetTitle] [From.GetFirstName] [From.GetOnlyDynastyName]'s tournament.;[FromFrom.GetTitledFirstName] [FromFrom.GetOnlyDynastyName] a été horiblement mutilé lors d'une joute au tournoi de [From.GetTitle] [From.GetFirstName] [From.GetOnlyDynastyName].;[FromFrom.GetTitledFirstName] [FromFrom.GetOnlyDynastyName] has been horrifically maimed jousting in [From.GetTitle] [From.GetFirstName] [From.GetOnlyDynastyName]'s tournament.;;[FromFrom.GetTitledFirstName] [FromFrom.GetOnlyDynastyName] has been horrifically maimed jousting in [From.GetTitle] [From.GetFirstName] [From.GetOnlyDynastyName]'s tournament.;;;;;;;;;x
EVTDESC70091;[FromFrom.GetTitledFirstName] [FromFrom.GetOnlyDynastyName] has been badly wounded fighting in [From.GetTitle] [From.GetFirstName] [From.GetOnlyDynastyName]'s tournament.;[FromFrom.GetTitledFirstName] [FromFrom.GetOnlyDynastyName] a été sévèrement blessé lors d'un combat au tournoi de [From.GetTitle] [From.GetFirstName] [From.GetOnlyDynastyName].;[FromFrom.GetTitledFirstName] [FromFrom.GetOnlyDynastyName] has been badly wounded fighting in [From.GetTitle] [From.GetFirstName] [From.GetOnlyDynastyName]'s tournament.;;[FromFrom.GetTitledFirstName] [FromFrom.GetOnlyDynastyName] has been badly wounded fighting in [From.GetTitle] [From.GetFirstName] [From.GetOnlyDynastyName]'s tournament.;;;;;;;;;x
EVTDESC70092;After much food, wine, jousting and combat, [From.GetTitle] [From.GetFirstName] [From.GetOnlyDynastyName]'s Tourney has finally ended.;Après de nombreux festins, beuveries, joutes et combats, le Tournoi de [From.GetTitle] [From.GetFirstName] [From.GetOnlyDynastyName] a finalement pris fin.;After much food, wine, jousting and combat, [From.GetTitle] [From.GetFirstName] [From.GetOnlyDynastyName]'s Tourney has finally ended.;;After much food, wine, jousting and combat, [From.GetTitle] [From.GetFirstName] [From.GetOnlyDynastyName]'s Tourney has finally ended.;;;;;;;;;x
EVTDESC70095;My [GetFromRelation] [From.GetTitledFirstName] has shown time and time again their skill at arms during the Tourney. Despite not winning, [From.GetSheHe] prevailed against many knights in the lists, covering [From.GetHerHim]self in glory.;Mon(a) [GetFromRelation] [From.GetTitledFirstName] a montré à de nombreuses reprises sa maîtrise des armes durant le Tournoi. Même s'[From.GetSheHe] n'a pas gagné, [From.GetSheHe] a battu de nombreux chevaliers dans les lices, se couvrant de gloire.;My [GetFromRelation] [From.GetTitledFirstName] has shown time and time again their skill at arms during the Tourney. Despite not winning, [From.GetSheHe] prevailed against many knights in the lists, covering [From.GetHerHim]self in glory.;;My [GetFromRelation] [From.GetTitledFirstName] has shown time and time again their skill at arms during the Tourney. Despite not winning, [From.GetSheHe] prevailed against many knights in the lists, covering [From.GetHerHim]self in glory.;;;;;;;;;x
EVTDESC70096;My [GetFromRelation] [From.GetTitledFirstName] may not have won any of the melee events in the Tourney but [From.GetHerHis] prowess in the lists did not go unnoticed.;Mon(a) [GetFromRelation] [From.GetTitledFirstName] n'a peut-être pas remporté de mélée lors du Tournoi, mais ses prouesses dans les lices ne sont pas passées inaperçues.;My [GetFromRelation] [From.GetTitledFirstName] may not have won any of the melee events in the Tourney but [From.GetHerHis] prowess in the lists did not go unnoticed.;;My [GetFromRelation] [From.GetTitledFirstName] may not have won any of the melee events in the Tourney but [From.GetHerHis] prowess in the lists did not go unnoticed.;;;;;;;;;x
EVTDESC70097;My [GetFromRelation] [From.GetTitledFirstName] failed to display their full prowess during the Tourney. [From.GetSheHeCap] won a handful of tilts against lesser men, but was soundly beaten in the later lists.;Mon(a) [GetFromRelation] [From.GetTitledFirstName] n'a pas réussi à montrer toute sa valeur durant le Tournoi. [From.GetSheHeCap] a remporté une poignée de victoires contre des hommes de moindre valeur, mais a été sèchement vaincu dans les dernières lices.;My [GetFromRelation] [From.GetTitledFirstName] failed to display their full prowess during the Tourney. [From.GetSheHeCap] won a handful of tilts against lesser men, but was soundly beaten in the later lists.;;My [GetFromRelation] [From.GetTitledFirstName] failed to display their full prowess during the Tourney. [From.GetSheHeCap] won a handful of tilts against lesser men, but was soundly beaten in the later lists.;;;;;;;;;x
EVTDESC70098;My [GetFromRelation] [From.GetTitledFirstName] was vanquished in the early rounds of the Tourney. We can still hear the scorn of the crowd, after [From.GetSheHe] was unhorsed time after time.;Mon(a) [GetFromRelation] [From.GetTitledFirstName] a été vaincu dans les premiers tours du Tournoi. Nous pouvons encore entendre le mépris et les railleries de la foule à chaque fois qu'[From.GetSheHe] était désarçonné(e).;My [GetFromRelation] [From.GetTitledFirstName] was vanquished in the early rounds of the Tourney. We can still hear the scorn of the crowd, after [From.GetSheHe] was unhorsed time after time.;;My [GetFromRelation] [From.GetTitledFirstName] was vanquished in the early rounds of the Tourney. We can still hear the scorn of the crowd, after [From.GetSheHe] was unhorsed time after time.;;;;;;;;;x
EVTDESCjoust.0;It is time to prove you know how to joust, your name has come up in the tournament roster.;It is time to prove you know how to joust, your name has come up in the tournament roster.;It is time to prove you know how to joust, your name has come up in the tournament roster.;;It is time to prove you know how to joust, your name has come up in the tournament roster.;;;;;;;;;x
EVTDESCjoust.10;The joust is over, and both participants have managed to avoid any injuries.;The joust is over, and both participants have managed to avoid any injuries.;The joust is over, and both participants have managed to avoid any injuries.;;The joust is over, and both participants have managed to avoid any injuries.;;;;;;;;;x
EVTDESCjoust.11;The joust is over, and the loser was wounded!;The joust is over, and the loser was wounded!;The joust is over, and the loser was wounded!;;The joust is over, and the loser was wounded!;;;;;;;;;x
EVTDESCjoust.12;The joust is over, and the loser was maimed!;The joust is over, and the loser was maimed!;The joust is over, and the loser was maimed!;;The joust is over, and the loser was maimed!;;;;;;;;;x
EVTDESCjoust.13;The joust is over, and the loser was killed!;The joust is over, and the loser was killed!;The joust is over, and the loser was killed!;;The joust is over, and the loser was killed!;;;;;;;;;x
EVTDESCjoust.1;You are facing your next opponent in the joust. You climb your horse and your squire hands you your lance and shield. This is your chance to prove your worth!;You are facing your next opponent in the joust. You climb your horse and your squire hands you your lance and shield. This is your chance to prove your worth!;You are facing your next opponent in the joust. You climb your horse and your squire hands you your lance and shield. This is your chance to prove your worth!;;You are facing your next opponent in the joust. You climb your horse and your squire hands you your lance and shield. This is your chance to prove your worth!;;;;;;;;;x
EVTDESCjoust.20;The duel is fought, and honor is satisfied even if no blood was shed.;The duel is fought, and honor is satisfied even if no blood was shed.;The duel is fought, and honor is satisfied even if no blood was shed.;;The duel is fought, and honor is satisfied even if no blood was shed.;;;;;;;;;x
EVTDESCjoust.21;The duel is fought, and the loser is lying on the ground, not moving. Honor is satisfied.;The duel is fought, and the loser is lying on the ground, not moving. Honor is satisfied.;The duel is fought, and the loser is lying on the ground, not moving. Honor is satisfied.;;The duel is fought, and the loser is lying on the ground, not moving. Honor is satisfied.;;;;;;;;;x
EVTDESCjoust.2;Both knights are prepared for the event. Their lances are shining in the sun while the crowd looks on expectantly.;Both knights are prepared for the event. Their lances are shining in the sun while the crowd looks on expectantly.;Both knights are prepared for the event. Their lances are shining in the sun while the crowd looks on expectantly.;;Both knights are prepared for the event. Their lances are shining in the sun while the crowd looks on expectantly.;;;;;;;;;x
EVTDESCjoust.3;Your opponent [From.GetTitledFirstName] stands down from the jousts, and will no longer participate in this part of the tournament.;Your opponent [From.GetTitledFirstName] stands down from the jousts, and will no longer participate in this part of the tournament.;Your opponent [From.GetTitledFirstName] stands down from the jousts, and will no longer participate in this part of the tournament.;;Your opponent [From.GetTitledFirstName] stands down from the jousts, and will no longer participate in this part of the tournament.;;;;;;;;;x
EVTOPTA70000;A chance to prove my worth;Une chance de prouver ma valeur;A chance to prove my worth;;A chance to prove my worth;;;;;;;;;x
EVTOPTA70008;Hopefully they feel the same way;Hopefully they feel the same way;Hopefully they feel the same way;;Hopefully they feel the same way;;;;;;;;;x
EVTOPTA70031;I am more diplomatic than I thought.;Je suis plus diplomate que je le pensais.;I am more diplomatic than I thought.;;I am more diplomatic than I thought.;;;;;;;;;x
EVTOPTA70050;I feel the same way;I feel the same way;I feel the same way;;I feel the same way;;;;;;;;;x
EVTOPTA70051;I am so happy!;I am so happy!;I am so happy!;;I am so happy!;;;;;;;;;x
EVTOPTA70052;[FromFrom.GetSheHeCap] truly deserves it!;[FromFrom.GetSheHeCap] le mérite vraiment !;[FromFrom.GetSheHeCap] truly deserves it!;;[FromFrom.GetSheHeCap] truly deserves it!;;;;;;;;;x
EVTOPTA70053;She is truely a beauty;Elle est réellement une beauté.;She is truely a beauty;;She is truely a beauty;;;;;;;;;x
EVTOPTA70054;Hedge Knights don't belong here;Les Chevaliers Errants n'ont rien à faire ici.;Hedge Knights don't belong here;;Hedge Knights don't belong here;;;;;;;;;x
EVTOPTA70057;How wonderful!;Que c'est merveilleux !;How wonderful!;;How wonderful!;;;;;;;;;x
EVTOPTA70058;A good choice;Un bon choix.;A good choice;;A good choice;;;;;;;;;x
EVTOPTA70060;Do I really care now?;Je m'en fiche désormais.;Do I really care now?;;Do I really care now?;;;;;;;;;x
EVTOPTA70061;He merely jests;Ce n'était que de simples plaisanteries.;He merely jests;;He merely jests;;;;;;;;;x
EVTOPTA70062;I will dominate him;Je vais le battre.;I will dominate him;;I will dominate him;;;;;;;;;x
EVTOPTA70063;I apologise profusely;Je lui présente mes excuses.;I apologise profusely;;I apologise profusely;;;;;;;;;x
EVTOPTA70064;Good;Bien;Good;;Good;;;;;;;;;x
EVTOPTA70065;My honour is restored;Mon honneur est lavé…;My honour is restored;;My honour is restored;;;;;;;;;x
EVTOPTA70066;Until the next time...;Jusqu'à la prochaine fois…;Until the next time...;;Until the next time...;;;;;;;;;x
