#CODE;ENGLISH;FRENCH;GERMAN;;SPANISH;;;;;;;;;x
EVTOPTA70067;The humiliation...;Quelle humiliation…;The humiliation...;;The humiliation...;;;;;;;;;x
EVTOPTA70068;The humiliation...;Quelle humiliation…;The humiliation...;;The humiliation...;;;;;;;;;x
EVTOPTA70071;How exciting!;Que c'est excitant !;How exciting!;;How exciting!;;;;;;;;;x
EVTOPTA70074;I shall pursue her;Je vais lui faire des avances.;I shall pursue her;;I shall pursue her;;;;;;;;;x
EVTOPTA70075;Embrace the passion;Embrassez la passion;Embrace the passion;;Embrace the passion;;;;;;;;;x
EVTOPTA70076;Great!;Génial !;Great!;;Great!;;;;;;;;;x
EVTOPTA70077;I'll have to find some wench then;Je devrai chercher une autre jouvencelle dans ce cas.;I'll have to find some wench then;;I'll have to find some wench then;;;;;;;;;x
EVTOPTA70078;Grand Tourney;Grand Tournoi;Grand Tourney;;Grand Tourney;;;;;;;;;x
EVTOPTA70079;Winners;Vainqueurs;Winners;;Winners;;;;;;;;;x
EVTOPTA70082;Gods be good, what was I thinking...;Que les Dieux soient bons, à quoi pensais-je…;Gods be good, what was I thinking...;;Gods be good, what was I thinking...;;;;;;;;;x
EVTOPTA70083;Ha! Now there's a [From.GetManWoman] who knows how to celebrate!;Ha ! Voilà un(e) [From.GetManWoman] qui sait faire la fête !;Ha! Now there's a [From.GetManWoman] who knows how to celebrate!;;Ha! Now there's a [From.GetManWoman] who knows how to celebrate!;;;;;;;;;x
EVTOPTA70084;There'll be no glory for me this year.;Il n'y aura pas de gloire pour moi cette année.;There'll be no glory for me this year.;;There'll be no glory for me this year.;;;;;;;;;x
EVTOPTA70085;There'll be no glory for me this year.;Il n'y aura pas de gloire pour moi cette année.;There'll be no glory for me this year.;;There'll be no glory for me this year.;;;;;;;;;x
EVTOPTA70086;I will attend, It shall be entertaining!;Je serai présent, ce sera amusant !;I will attend, It shall be entertaining!;;I will attend, It shall be entertaining!;;;;;;;;;x
EVTOPTA70087;A worthy runner up;Un digne second.;A worthy runner up;;A worthy runner up;;;;;;;;;x
EVTOPTA70088;[FromFrom.GetSheHeCap] fought well;[FromFrom.GetSheHeCap] s'est bien battu !;[FromFrom.GetSheHeCap] fought well;;[FromFrom.GetSheHeCap] fought well;;;;;;;;;x
EVTOPTA70089;How unfortunate;Quel malheur !;How unfortunate;;How unfortunate;;;;;;;;;x
EVTOPTA70092;It was a fine spectacle!;Ce fut un beau spectacle !;It was a fine spectacle!;;It was a fine spectacle!;;;;;;;;;x
EVTOPTAjoust.1;My lance is ready for you.;My lance is ready for you.;My lance is ready for you.;;My lance is ready for you.;;;;;;;;;x
EVTOPTAjoust.2;My lance is ready for you.;My lance is ready for you.;My lance is ready for you.;;My lance is ready for you.;;;;;;;;;x
EVTOPTB70003;My squire deserves some credit;Mon écuyer mérite un certain crédit.;My squire deserves some credit;;My squire deserves some credit;;;;;;;;;x
EVTOPTB70005;Personally I blame my squire;Personnellement, je blâme mon écuyer.;Personally I blame my squire;;Personally I blame my squire;;;;;;;;;x
EVTOPTB70050;It was fun, but let's end it here.;It was fun, but let's end it here.;It was fun, but let's end it here.;;It was fun, but let's end it here.;;;;;;;;;x
EVTOPTB70053;She is of a great family;Elle est d'une grande famille.;She is of a great family;;She is of a great family;;;;;;;;;x
EVTOPTB70054;I shall welcome him;Je l'accueillerai.;I shall welcome him;;I shall welcome him;;;;;;;;;x
EVTOPTB70059;This is a great honour for our house;C'est un grand honneur pour notre Maison.;This is a great honour for our house;;This is a great honour for our house;;;;;;;;;x
EVTOPTB70061;I will show him;Je vais lui montrer.;I will show him;;I will show him;;;;;;;;;x
EVTOPTB70063;I accept!;J'accepte !;I accept!;;I accept!;;;;;;;;;x
EVTOPTB70074;She's not for me;Elle n'est pas pour moi.;She's not for me;;She's not for me;;;;;;;;;x
EVTOPTB70075;No thanks;Non merci.;No thanks;;No thanks;;;;;;;;;x
EVTOPTB70078;Tournament;Tournoi Régional;Tournament;;Tournament;;;;;;;;;x
EVTOPTB70079;Runners-up;Seconde place;Runners-up;;Runners-up;;;;;;;;;x
EVTOPTB70083;This is an outrage!;C'est un outrage !;This is an outrage!;;This is an outrage!;;;;;;;;;x
EVTOPTB70086;I have better things to do than watch jousting;J'ai des choses plus importantes à faire qu'à regarder des joutes.;I have better things to do than watch jousting;;I have better things to do than watch jousting;;;;;;;;;x
EVTOPTB70087;[FromFrom.GetSheHeCap] brought honour to House [Root.GetOnlyDynastyName];[FromFrom.GetSheHeCap] a fait honneur à la Maison [Root.GetOnlyDynastyName].;[FromFrom.GetSheHeCap] brought honour to House [Root.GetOnlyDynastyName];;[FromFrom.GetSheHeCap] brought honour to House [Root.GetOnlyDynastyName];;;;;;;;;x
EVTOPTBjoust.1;Oh my… I really don't want to go through with this!;Oh my… I really don't want to go through with this!;Oh my… I really don't want to go through with this!;;Oh my… I really don't want to go through with this!;;;;;;;;;x
EVTOPTC70000;This is below me;C'est au-dessous de mon niveau.;This is below me;;This is below me;;;;;;;;;x
EVTOPTC70053;She is my love;C'est mon amour.;She is my love;;She is my love;;;;;;;;;x
EVTOPTC70061;That's it! I challenge you to single combat!;Très bien ! Je vous défie en combat singulier !;That's it! I challenge you to single combat!;;That's it! I challenge you to single combat!;;;;;;;;;x
EVTOPTC70078;Local Tourney;Tournoi Local;Local Tourney;;Local Tourney;;;;;;;;;x
EVTOPTC70079;Third Place;Troisième place;Third Place;;Third Place;;;;;;;;;x
EVTOPTC70087;Glory to House [Root.GetOnlyDynastyName]!;Gloire à la Maison [Root.GetOnlyDynastyName] !;Glory to House [Root.GetOnlyDynastyName]!;;Glory to House [Root.GetOnlyDynastyName]!;;;;;;;;;x
EVTOPTC70095;This reflects well on me and House [Root.GetOnlyDynastyName];Cela rejaillit sur moi et sur la Maison [Root.GetOnlyDynastyName].;This reflects well on me and House [Root.GetOnlyDynastyName];;This reflects well on me and House [Root.GetOnlyDynastyName];;;;;;;;;x
EVTOPTC70096;A good showing for House [Root.GetOnlyDynastyName];Une belle démonstration pour la Maison [Root.GetOnlyDynastyName].;A good showing for House [Root.GetOnlyDynastyName];;A good showing for House [Root.GetOnlyDynastyName];;;;;;;;;x
EVTOPTC70097;A poor showing for House [Root.GetOnlyDynastyName];Une bien piètre démonstration pour la Maison [Root.GetOnlyDynastyName].;A poor showing for House [Root.GetOnlyDynastyName];;A poor showing for House [Root.GetOnlyDynastyName];;;;;;;;;x
EVTOPTC70098;[From.GetSheHeCap] brings shame to House [Root.GetOnlyDynastyName];[From.GetSheHeCap] a couvert de honte la Maison [Root.GetOnlyDynastyName].;[From.GetSheHeCap] brings shame to House [Root.GetOnlyDynastyName];;[From.GetSheHeCap] brings shame to House [Root.GetOnlyDynastyName];;;;;;;;;x
EVTOPTD70000;No, don't bother me about tourneys again!;Non, ne me dérangez pas à nouveau à propos de tournois !;No, don't bother me about tourneys again!;;No, don't bother me about tourneys again!;;;;;;;;;x
EVTOPTD70053;Hmm, she will do;Hmm, cela ira.;Hmm, she will do;;Hmm, she will do;;;;;;;;;x
EVTOPTE70000;Don't ask me about these small tournies again!;Ne me dérangez plus à propos de ces petits tournois !;Don't ask me about these small tournies again!;;Don't ask me about these small tournies again!;;;;;;;;;x
EVTOPTF70000;Don't ask me about these type of tournies again!;Ne me dérangez plus à propos de ce type de tournois !;Don't ask me about these type of tournies again!;;Don't ask me about these type of tournies again!;;;;;;;;;x
EVTTOOLTIP70057;will be most pleased;sera enchantée;will be most pleased;;will be most pleased;;;;;;;;;x
EVTTOOLTIP70062;will become your rival;va devenir votre rival;will become your rival;;will become your rival;;;;;;;;;x
EVTTOOLTIP70063;will be challenged to a duel;va être défié en duel;will be challenged to a duel;;will be challenged to a duel;;;;;;;;;x
EVTTOOLTIP70064;You apologize to [From.GetTitledFirstName] [From.GetOnlyDynastyName];You apologize to [From.GetTitledFirstName] [From.GetOnlyDynastyName];You apologize to [From.GetTitledFirstName] [From.GetOnlyDynastyName];;You apologize to [From.GetTitledFirstName] [From.GetOnlyDynastyName];;;;;;;;;x
EVTTOOLTIP70069;The duel will end inconclusively;Le duel ne sera pas concluant.;The duel will end inconclusively;;The duel will end inconclusively;;;;;;;;;x
EVTTOOLTIP70075;will respond to your advances;va répondre à vos avances;will respond to your advances;;will respond to your advances;;;;;;;;;x
EVTTOOLTIP70076;will be thrilled;va être ravi;will be thrilled;;will be thrilled;;;;;;;;;x
EVTTOOLTIP70077;will be disappointed;va être déçu;will be disappointed;;will be disappointed;;;;;;;;;x
EVTTOOLTIPjoust.2;will be your opponent in the joust.;will be your opponent in the joust.;will be your opponent in the joust.;;will be your opponent in the joust.;;;;;;;;;x
hold_a_epic_tournament;Hold a Grand tourney of [Root.Capital.GetName];Organiser un grand tournoi à [Root.Capital.GetName];;;;;;;;;;;;x
hold_a_epic_tournament_desc;Let us hold a tournament the like of which is only rumoured. All Knights and Lords of the realm will gather at [Root.Capital.GetName];Allons, organisons un tournoi comme nul autre pareil. Tous les chevaliers et les seigneurs du Royaume se rassembleront à [Root.Capital.GetName];;;;;;;;;;;;x
normal_tourny_1st_1;Tournament wins: 1;Victoires Tournoi Régional: 1;Tournament wins: 1;;Tournament wins: 1;;;;;;;;;x
normal_tourny_1st_2;Tournament wins: 2;Victoires Tournoi Régional: 2;Tournament wins: 2;;Tournament wins: 2;;;;;;;;;x
normal_tourny_1st_3;Tournament wins: 3;Victoires Tournoi Régional: 3;Tournament wins: 3;;Tournament wins: 3;;;;;;;;;x
normal_tourny_1st_4;Tournament wins: 4;Victoires Tournoi Régional: 4;Tournament wins: 4;;Tournament wins: 4;;;;;;;;;x
normal_tourny_1st_5;Tournament wins: 5+;Victoires Tournoi Régional: 5+;Tournament wins: 5+;;Tournament wins: 5+;;;;;;;;;x
normal_tourny_2nd_1;Tournament second places: 1;Secondes places Tournoi Régional: 1;Tournament second places: 1;;Tournament second places: 1;;;;;;;;;x
normal_tourny_2nd_2;Tournament second places: 2;Secondes places Tournoi Régional: 2;Tournament second places: 2;;Tournament second places: 2;;;;;;;;;x
normal_tourny_2nd_3;Tournament second places: 3;Secondes places Tournoi Régional: 3;Tournament second places: 3;;Tournament second places: 3;;;;;;;;;x
normal_tourny_2nd_4;Tournament second places: 4;Secondes places Tournoi Régional: 4;Tournament second places: 4;;Tournament second places: 4;;;;;;;;;x
normal_tourny_2nd_5;Tournament second places: 5+;Secondes places Tournoi Régional: 5+;Tournament second places: 5+;;Tournament second places: 5+;;;;;;;;;x
normal_tourny_3rd_1;Tournament third places: 1;Troisèmes places Tournoi Régional: 1;Tournament third places: 1;;Tournament third places: 1;;;;;;;;;x
normal_tourny_3rd_2;Tournament third places: 2;Troisèmes places Tournoi Régional: 2;Tournament third places: 2;;Tournament third places: 2;;;;;;;;;x
normal_tourny_3rd_3;Tournament third places: 3;Troisèmes places Tournoi Régional: 3;Tournament third places: 3;;Tournament third places: 3;;;;;;;;;x
normal_tourny_3rd_4;Tournament third places: 4;Troisèmes places Tournoi Régional: 4;Tournament third places: 4;;Tournament third places: 4;;;;;;;;;x
normal_tourny_3rd_5;Tournament third places: 5+;Troisèmes places Tournoi Régional: 5+;Tournament third places: 5+;;Tournament third places: 5+;;;;;;;;;x
opinion_attending_tournament;Attending tournament;Attending tournament;Attending tournament;;Attending tournament;;;;;;;;;x
opinion_potential_tourny_rival;Potential Tourney Rival;Potentiel rival en tournoi;Potential Tourney Rival;;Potential Tourney Rival;;;;;;;;;x
opinion_queen_love_beauty;Queen of love and beauty;Reine d'amour et de beauté;Queen of love and beauty;;Queen of love and beauty;;;;;;;;;x
opinion_queen_love_beauty_chosen;Chosen queen of love and beauty;Choisir la reine d'amour et de beauté;Chosen queen of love and beauty;;Chosen queen of love and beauty;;;;;;;;;x
opinion_spectating_tournament;Spectating Tournament;Spectateur du Tournoi;Spectating Tournament;;Spectating Tournament;;;;;;;;;x
opinion_squire_honoured;Honoured Squire;Ecuyer honoré;Honoured Squire;;Honoured Squire;;;;;;;;;x
opinion_squire_humiliated;Humiliated Squire;Ecuyer Humilié;Humiliated Squire;;Humiliated Squire;;;;;;;;;x
opinion_tournament_spectator;Attended Tourney;A assisé au Tournoi;Attended Tourney;;Attended Tourney;;;;;;;;;x
OUTCOME_1;Great;Great;Great;;Great;;;;;;;;;x
OUTCOME_2;Modest;Modest;Modest;;Modest;;;;;;;;;x
OUTCOME_3;Bad;Bad;Bad;;Bad;;;;;;;;;x
OUTCOME_4;Horrible;Horrible;Horrible;;Horrible;;;;;;;;;x
show_me_the_medal_winners;Show tourney medal winners;Voir les vainqueurs de médailles dans des tournois.;Show tourney medal winners;;Show tourney medal winners;;;;;;;;;x
show_me_the_medal_winners_desc;Show tourney medal winners;Voir les vainqueurs de médailles dans des tournois.;Show tourney medal winners;;Show tourney medal winners;;;;;;;;;x
TOURNAMENTTITLE2;Tournament of [From.Capital.GetName];Tournoi de [From.Capital.GetName];Tourney of [From.Capital.GetName];;Tourney of [From.Capital.GetName];;;;;;;;;x
TOURNAMENTTITLE3;Tournament of [Root.Capital.GetName];Tournoi de [Root.Capital.GetName];Tourney of [Root.Capital.GetName];;Tourney of [Root.Capital.GetName];;;;;;;;;x
TOURNAMENTTITLE4;Tournament of [FromFrom.Capital.GetName];Tournoi de [FromFrom.Capital.GetName];Tourney of [FromFrom.Capital.GetName];;Tourney of [FromFrom.Capital.GetName];;;;;;;;;x
TOURNAMENTTITLE;Jousting Tournament;Joute;Jousting Tournament;;Jousting Tournament;;;;;;;;;x
tournament_cooldown;[From.GetTitledFirstName] [From.GetOnlyDynastyName] has not held a tournament in the last decade\n;[From.GetTitledFirstName] [From.GetOnlyDynastyName] has not held a tournament in the last decade\n;[From.GetTitledFirstName] [From.GetOnlyDynastyName] has not held a tournament in the last decade\n;;[From.GetTitledFirstName] [From.GetOnlyDynastyName] has not held a tournament in the last decade\n;;;;;;;;;x
tournament_invite;Let all Knights and Lords of the realm be invited;Inviter tous les chevaliers et les seigneurs du Royaume;;;;;;;;;;;;x
tournament_invite_1;Let all Knights and Lords of the region be invited;Permettez à tous les Chevaliers et Seigneurs de la région d'être invités.;Let all Knights and Lords of the region be invited;;Let all Knights and Lords of the region be invited;;;;;;;;;x
tournament_invite_2;Let all local Knights and Lords be invited;Permettez à tous les Chevaliers et Seigneurs des environs d'être invités.;Let all local Knights and Lords be invited;;Let all local Knights and Lords be invited;;;;;;;;;x
tournament_in_progress;No tournament of equal or higher rank is currently being held in the realm\n;No tournament of equal or higher rank is currently being held in the realm\n;No tournament of equal or higher rank is currently being held in the realm\n;;No tournament of equal or higher rank is currently being held in the realm\n;;;;;;;;;x